{
  "schema": "troupe.diagnostics.performance-raw.v1",
  "kind": "calibration",
  "identity": {
    "actor_design_sha256": "acb963576a100e98415418dbc6f68cb4b605c642d06f2c06620ffc4e29a19021",
    "diagnostics_design_sha256": "b06d3a8097780787fce3d73f7b623526ef0f4ec30b09c2c9277227b5c74a454d",
    "plan_sha256": "297dc9d231fbd7ca6016f3483e7be17d2192a174279dab6cef4eca8cb3fb0a77",
    "validator_sha256": "d640124503e370b8597e81f914e82824ce3b1798e12dea82c6aea99ef390cab8",
    "review_record_sha256": "9c05ae2d24f08fb5bff470691bfbc88bf2dee26de67ec1b63838bd5a3af7c1ca",
    "integration_sha": "051361bc99e2cc179d705bc48b156176c20b1f3b"
  },
  "environment": {
    "system": {
      "platform": "linux",
      "release": "6.8.0-124-generic",
      "architecture": "x64",
      "cpu_model": "AMD EPYC 9654 96-Core Processor",
      "logical_cpu_count": 384,
      "total_memory_bytes": 608139292672
    },
    "frequency_policy": {
      "governor": "schedutil",
      "driver": "acpi-cpufreq",
      "minimum_khz": "1500000",
      "maximum_khz": "3709357",
      "boost": "1"
    },
    "toolchain": {
      "node_version": "v22.22.0",
      "npm_version": "10.9.4",
      "playwright_version": "1.62.1",
      "chromium_revision": "1234",
      "chromium_version": "151.0.7922.34",
      "chromium_expected_version": "151.0.7922.34",
      "playwright_platform": "ubuntu22.04-x64"
    },
    "cache": {
      "package_lock_sha256": "d02077d88fce2afe6c62a2f6d5aa75b2a5bcfe6cbbda040f1cffbffe35eba595",
      "npm_cache_manifest_sha256": "342bda128372b4fd0caa81410078db66a08228de49ac1a81c6f63a62af0b6aea",
      "browser_contract_sha256": "19a225a7747d22b60fb56afcfe4ea9b25846058295fd57128b021cdba9e9b8c5",
      "browser_cache_manifest_sha256": "f403a1698a959ee0ac7af4fba10717ddf949b8bac67ab05c6299373fb95e918b"
    }
  },
  "exclusive_interval": {
    "resource": "benchmark-host",
    "lease_id_sha256": "2037037dce027fbaa08a31792a8c42e467eace78e9665e065f1ddb38ac38f917",
    "holder_pid": 3683584,
    "started_at_epoch_ns": "1786959483272279612",
    "ended_at_epoch_ns": "1786959511185000000"
  },
  "workload": {
    "long_run_events": 12000,
    "pause_events": 4000,
    "visible_primitives": 10000,
    "hit_tests": 2000,
    "rerenders_per_frame": 100,
    "query_entries": 80,
    "activated_windows": 8
  },
  "reference": {
    "baseline_sha256": "971cf1323159e370cf4aebd2592ece9bdf9505c1b507b7ff998c6d5cdd2fceec",
    "baseline_raw_sha256": null,
    "review_sha256": null
  },
  "samples": [
    {
      "attempt": 1,
      "measured_at_epoch_ms": 1786959508855,
      "browser_version": "151.0.7922.34",
      "durations_ms": {
        "state_reduce_ms": 122.60000038146973,
        "pause_reduce_ms": 105.39999961853027,
        "timeline_layout_ms": 11.199999809265137,
        "timeline_draw_ms": 11.299999237060547,
        "hit_test_ms": 1.9000005722045898,
        "raf_updates_ms": 11.800000190734863
      },
      "heap_bytes": {
        "before": 1632576,
        "peak": 5765664,
        "after": 5021448,
        "retained": 3388872,
        "recovery_ratio": 0.8199370543283859
      },
      "invariants": {
        "live_events": 256,
        "span_items": 256,
        "message_items": 128,
        "context_usage_items": 128,
        "act_usage_items": 256,
        "tool_items": 256,
        "result_items": 256,
        "gap_items": 128,
        "query_entries": 64,
        "adjacent_windows": 4,
        "selection_preserved": true,
        "span_pair_complete": true,
        "usage_coverage_complete": true,
        "gap_state_visible": true,
        "pause_frozen": true,
        "pause_unseen_count": "4000",
        "resume_request_kind": "server_range",
        "resume_query_consumed": true,
        "raw_backlog_events": 256,
        "visible_primitives": 10000,
        "drawn_primitives": 10000,
        "hit_examined_max": 1,
        "raf_callbacks_pending": 2,
        "raf_draws": 1,
        "canvas_nonblank": true
      }
    },
    {
      "attempt": 2,
      "measured_at_epoch_ms": 1786959509900,
      "browser_version": "151.0.7922.34",
      "durations_ms": {
        "state_reduce_ms": 137.10000038146973,
        "pause_reduce_ms": 109.59999942779541,
        "timeline_layout_ms": 14.100000381469727,
        "timeline_draw_ms": 14.399999618530273,
        "hit_test_ms": 2.700000762939453,
        "raf_updates_ms": 12.299999237060547
      },
      "heap_bytes": {
        "before": 1632576,
        "peak": 5761792,
        "after": 5017648,
        "retained": 3385072,
        "recovery_ratio": 0.819785644538818
      },
      "invariants": {
        "live_events": 256,
        "span_items": 256,
        "message_items": 128,
        "context_usage_items": 128,
        "act_usage_items": 256,
        "tool_items": 256,
        "result_items": 256,
        "gap_items": 128,
        "query_entries": 64,
        "adjacent_windows": 4,
        "selection_preserved": true,
        "span_pair_complete": true,
        "usage_coverage_complete": true,
        "gap_state_visible": true,
        "pause_frozen": true,
        "pause_unseen_count": "4000",
        "resume_request_kind": "server_range",
        "resume_query_consumed": true,
        "raw_backlog_events": 256,
        "visible_primitives": 10000,
        "drawn_primitives": 10000,
        "hit_examined_max": 1,
        "raf_callbacks_pending": 2,
        "raf_draws": 1,
        "canvas_nonblank": true
      }
    },
    {
      "attempt": 3,
      "measured_at_epoch_ms": 1786959511003,
      "browser_version": "151.0.7922.34",
      "durations_ms": {
        "state_reduce_ms": 167.9000005722046,
        "pause_reduce_ms": 114.89999961853027,
        "timeline_layout_ms": 13.399999618530273,
        "timeline_draw_ms": 10.5,
        "hit_test_ms": 1.8000001907348633,
        "raf_updates_ms": 13.800000190734863
      },
      "heap_bytes": {
        "before": 1632576,
        "peak": 5763240,
        "after": 5018740,
        "retained": 3386164,
        "recovery_ratio": 0.8197626338041535
      },
      "invariants": {
        "live_events": 256,
        "span_items": 256,
        "message_items": 128,
        "context_usage_items": 128,
        "act_usage_items": 256,
        "tool_items": 256,
        "result_items": 256,
        "gap_items": 128,
        "query_entries": 64,
        "adjacent_windows": 4,
        "selection_preserved": true,
        "span_pair_complete": true,
        "usage_coverage_complete": true,
        "gap_state_visible": true,
        "pause_frozen": true,
        "pause_unseen_count": "4000",
        "resume_request_kind": "server_range",
        "resume_query_consumed": true,
        "raw_backlog_events": 256,
        "visible_primitives": 10000,
        "drawn_primitives": 10000,
        "hit_examined_max": 1,
        "raf_callbacks_pending": 2,
        "raf_draws": 1,
        "canvas_nonblank": true
      }
    }
  ],
  "summary": {
    "duration_ms": {
      "state_reduce_ms": {
        "min": 122.60000038146973,
        "max": 167.9000005722046,
        "median": 137.10000038146973,
        "variance_ratio": 0.3304157553952681
      },
      "pause_reduce_ms": {
        "min": 105.39999961853027,
        "max": 114.89999961853027,
        "median": 109.59999942779541,
        "variance_ratio": 0.08667883256932506
      },
      "timeline_layout_ms": {
        "min": 11.199999809265137,
        "max": 14.100000381469727,
        "median": 13.399999618530273,
        "variance_ratio": 0.21641795931055893
      },
      "timeline_draw_ms": {
        "min": 10.5,
        "max": 14.399999618530273,
        "median": 11.299999237060547,
        "variance_ratio": 0.3451327329066949
      },
      "hit_test_ms": {
        "min": 1.8000001907348633,
        "max": 2.700000762939453,
        "median": 1.9000005722045898,
        "variance_ratio": 0.18000011444091796
      },
      "raf_updates_ms": {
        "min": 11.800000190734863,
        "max": 13.800000190734863,
        "median": 12.299999237060547,
        "variance_ratio": 0.16260163610204906
      }
    },
    "heap_bytes": {
      "peak_max": 5765664,
      "retained_max": 3388872,
      "recovery_ratio_max": 0.8199370543283859
    }
  },
  "result": {
    "status": "passed",
    "violations": [],
    "result_sha256": "80ed0b0dd7d496a384c29920658898220623161874366355971d2e215b66540c"
  }
}
